### ISSUE TITLE
When deploying CubeSandbox on Kubernetes, cross-node access to the sandbox is normal, but when accessing the sandbox from the same node, no network response is received.

### ISSUE THREAD

**Issue by wwthw** [TencentCloud/CubeSandbox#443]
### Question

CubeSandbox runs on a Kubernetes cluster, using Calico for CNI.

Host information: 76.0.121.10 and 76.0.145.47

The cubelet and network-agent run in a pod container (IP: 172.24.205.149) on the 76.0.121.10 node.

Note: The created sandbox has an IP of 192.168.0.3, exposing port 49999, with port 20007 mapped.

Scenario 1: Cross-node scenario

From host 76.0.145.47, executing `curl -i 76.0.121.10:20007/health` returns an "OK" response.

Explanation: A routing rule has been added to 76.0.121.10 to forward traffic from 76.0.121.10:20007 to pod 172.24.205.149:20007.

Scenario 2: Within the same pod container on the same node, via sandboxip:49999

From the pod container (ip:172.24.205.149), executing `curl -i 192.168.0.3:49999/health` returns an "OK" response.

Scenario 3: Within other pods on the same node

From the pod cubeproxy (IP: 172.27.205.177) on 76.0.121.10, `curl -i 172.24.205.149:20007/health` fails to return a response.

Scenario 4: On the same host node
From the host node 76.0.121.10, `curl -i 172.24.205.149:20007/health` fails to return a response.

Scenario 5: Within the same pod on the same node, via podip:20007
From the pod (IP: 172.24.205.149) corresponding to the network-agent on the 76.0.121.10 node, `curl -i 172.24.205.149:20007/health` fails to return a response.

**Comment by wwthw** [comment]
跨节点访问成功，抓包信息：
[root@master bpf]# nettrace  --addr 172.27.205.149 --port 20007 --detail
begin trace...
***************** 151026c0,8a4d6580 ***************
[1567223.763403] [151026c0][ip_route_input_slow ][cpu:20 ][ens5f1][pid:0      ][swapper/20  ][ns:0] TCP: 76.0.145.47:49546 -> 172.27.205.149:20007 seq:2965734068, ack:0, flags:S
[1567223.763414] [151026c0][fib_validate_source ][cpu:20 ][ens5f1][pid:0      ][swapper/20  ][ns:0] TCP: 76.0.145.47:49546 -> 172.27.205.149:20007 seq:2965734068, ack:0, flags:S
[1567223.763418] [151026c0][ip_forward          ][cpu:20 ][ens5f1][pid:0      ][swapper/20  ][ns:0] TCP: 76.0.145.47:49546 -> 172.27.205.149:20007 seq:2965734068, ack:0, flags:S
[1567223.763421] [151026c0][nf_hook_slow        ][cpu:20 ][ens5f1][pid:0      ][swapper/20  ][ns:0] TCP: 76.0.145.47:49546 -> 172.27.205.149:20007 seq:2965734068, ack:0, flags:S *ipv4 in chain: FORWARD*
[1567223.763423] [151026c0][nft_do_chain        ][cpu:20 ][ens5f1][pid:0      ][swapper/20  ][ns:0] TCP: 76.0.145.47:49546 -> 172.27.205.149:20007 seq:2965734068, ack:0, flags:S *iptables table:filter, chain:FORWARD*
[1567223.763440] [151026c0][ip_output           ][cpu:20 ][ens5f1][pid:0      ][swapper/20  ][ns:0] TCP: 76.0.145.47:49546 -> 172.27.205.149:20007 seq:2965734068, ack:0, flags:S
[1567223.763441] [151026c0][nf_hook_slow        ][cpu:20 ][cali52f76ea9a5][pid:0      ][swapper/20  ][ns:0] TCP: 76.0.145.47:49546 -> 172.27.205.149:20007 seq:2965734068, ack:0, flags:S *ipv4 in chain: POST_ROUTING*
[1567223.763442] [151026c0][nft_do_chain        ][cpu:20 ][cali52f76ea9a5][pid:0      ][swapper/20  ][ns:0] TCP: 76.0.145.47:49546 -> 172.27.205.149:20007 seq:2965734068, ack:0, flags:S *iptables table:mangle, chain:POSTROU*
[1567223.763444] [151026c0][nft_do_chain        ][cpu:20 ][cali52f76ea9a5][pid:0      ][swapper/20  ][ns:0] TCP: 76.0.145.47:49546 -> 172.27.205.149:20007 seq:2965734068, ack:0, flags:S *iptables table:nat, chain:POSTROU*
[1567223.763454] [151026c0][nf_nat_manip_pkt    ][cpu:20 ][cali52f76ea9a5][pid:0      ][swapper/20  ][ns:0] TCP: 76.0.145.47:49546 -> 172.27.205.149:20007 seq:2965734068, ack:0, flags:S
[1567223.763458] [151026c0][ip_finish_output    ][cpu:20 ][cali52f76ea9a5][pid:0      ][swapper/20  ][ns:0] TCP: 76.0.121.10:49546 -> 172.27.205.149:20007 seq:2965734068, ack:0, flags:S
[1567223.763460] [151026c0][ip_finish_output2   ][cpu:20 ][cali52f76ea9a5][pid:0      ][swapper/20  ][ns:0] TCP: 76.0.121.10:49546 -> 172.27.205.149:20007 seq:2965734068, ack:0, flags:S
[1567223.763466] [151026c0][skb_clone           ][cpu:20 ][cali52f76ea9a5][pid:0      ][swapper/20  ][ns:0] TCP: 76.0.121.10:49546 -> 172.27.205.149:20007 seq:2965734068, ack:0, flags:S
[1567223.763474] [8a4d6580][consume_skb         ][cpu:20 ][cali52f76ea9a5][pid:0      ][swapper/20  ][ns:0] TCP: 76.0.121.10:49546 -> 172.27.205.149:20007 seq:2965734068, ack:0, flags:S *packet is freed (normally)*
[1567223.763500] [151026c0][__dev_queue_xmit    ][cpu:20 ][cali52f76ea9a5][pid:0      ][swapper/20  ][ns:0] TCP: 76.0.121.10:49546 -> 172.27.205.149:20007 seq:2965734068, ack:0, flags:S
[1567223.763503] [151026c0][dev_hard_start_xmit ][cpu:20 ][cali52f76ea9a5][pid:0      ][swapper/20  ][ns:0] TCP: 76.0.121.10:49546 -> 172.27.205.149:20007 seq:2965734068, ack:0, flags:S *skb is successfully sent to the NIC driver*
[1567223.763505] [151026c0][enqueue_to_backlog  ][cpu:20 ][eth0 ][pid:0      ][swapper/20  ][ns:0] TCP: 76.0.121.10:49546 -> 172.27.205.149:20007 seq:2965734068, ack:0, flags:S
[1567223.763508] [151026c0][__netif_receive_skb_core][cpu:20 ][eth0 ][pid:0      ][swapper/20  ][ns:0] TCP: 76.0.121.10:49546 -> 172.27.205.149:20007 seq:2965734068, ack:0, flags:S
[1567223.763510] [151026c0][tcf_classify        ][cpu:20 ][eth0 ][pid:0      ][swapper/20  ][ns:0] TCP: 76.0.121.10:49546 -> 172.27.205.149:20007 seq:2965734068, ack:0, flags:S
[1567223.763513] [151026c0][cls_bpf_classify    ][cpu:20 ][eth0 ][pid:0      ][swapper/20  ][ns:0] TCP: 76.0.121.10:49546 -> 172.27.205.149:20007 seq:2965734068, ack:0, flags:S
[1567223.763517] [151026c0][__dev_queue_xmit    ][cpu:20 ][z192.168.0.3][pid:0      ][swapper/20  ][ns:0] TCP: 76.0.121.10:49546 -> 169.254.68.6:49999 seq:2965734068, ack:0, flags:S
[1567223.763520] [151026c0][dev_hard_start_xmit ][cpu:20 ][z192.168.0.3][pid:0      ][swapper/20  ][ns:0] TCP: 76.0.121.10:49546 -> 169.254.68.6:49999 seq:2965734068, ack:0, flags:S *skb is successfully sent to the NIC driver*
[1567223.763569] [151026c0][consume_skb         ][cpu:18 ][z192.168.0.3][pid:4134789][tap-0_qp0   ][ns:0] TCP: 76.0.121.10:49546 -> 169.254.68.6:49999 seq:2965734068, ack:0, flags:S *packet is freed (normally)*

***************** 327d9900 ***************
[1567223.763720] [327d9900][__dev_queue_xmit    ][cpu:18 ][eth0 ][pid:4134789][tap-0_qp0   ][ns:0] TCP: 172.27.205.149:20007 -> 76.0.121.10:49546 seq:2339673294, ack:2965734069, flags:SA
[1567223.763725] [327d9900][dev_hard_start_xmit ][cpu:18 ][eth0 ][pid:4134789][tap-0_qp0   ][ns:0] TCP: 172.27.205.149:20007 -> 76.0.121.10:49546 seq:2339673294, ack:2965734069, flags:SA *skb is successfully sent to the NIC driver*
[1567223.763728] [327d9900][enqueue_to_backlog  ][cpu:18 ][cali52f76ea9a5][pid:4134789][tap-0_qp0   ][ns:0] TCP: 172.27.205.149:20007 -> 76.0.121.10:49546 seq:2339673294, ack:2965734069, flags:SA
[1567223.763731] [327d9900][__netif_receive_skb_core][cpu:18 ][cali52f76ea9a5][pid:4134789][tap-0_qp0   ][ns:0] TCP: 172.27.205.149:20007 -> 76.0.121.10:49546 seq:2339673294, ack:2965734069, flags:SA
[1567223.763734] [327d9900][ip_rcv              ][cpu:18 ][cali52f76ea9a5][pid:4134789][tap-0_qp0   ][ns:0] TCP: 172.27.205.149:20007 -> 76.0.121.10:49546 seq:2339673294, ack:2965734069, flags:SA
[1567223.763737] [327d9900][ip_rcv_core         ][cpu:18 ][cali52f76ea9a5][pid:4134789][tap-0_qp0   ][ns:0] TCP: 172.27.205.149:20007 -> 76.0.121.10:49546 seq:2339673294, ack:2965734069, flags:SA
[1567223.763739] [327d9900][nf_hook_slow        ][cpu:18 ][cali52f76ea9a5][pid:4134789][tap-0_qp0   ][ns:0] TCP: 172.27.205.149:20007 -> 76.0.121.10:49546 seq:2339673294, ack:2965734069, flags:SA *ipv4 in chain: PRE_ROUTING*
[1567223.763743] [327d9900][nft_do_chain        ][cpu:18 ][cali52f76ea9a5][pid:4134789][tap-0_qp0   ][ns:0] TCP: 172.27.205.149:20007 -> 76.0.121.10:49546 seq:2339673294, ack:2965734069, flags:SA *iptables table:raw, chain:PREROUT*
[1567223.763752] [327d9900][nft_do_chain        ][cpu:18 ][cali52f76ea9a5][pid:4134789][tap-0_qp0   ][ns:0] TCP: 172.27.205.149:20007 -> 76.0.121.10:49546 seq:2339673294, ack:2965734069, flags:SA *iptables table:mangle, chain:PREROUT*
[1567223.763757] [327d9900][nf_nat_manip_pkt    ][cpu:18 ][cali52f76ea9a5][pid:4134789][tap-0_qp0   ][ns:0] TCP: 172.27.205.149:20007 -> 76.0.121.10:49546 seq:2339673294, ack:2965734069, flags:SA
[1567223.763760] [327d9900][ip_rcv_finish       ][cpu:18 ][cali52f76ea9a5][pid:4134789][tap-0_qp0   ][ns:0] TCP: 172.27.205.149:20007 -> 76.0.145.47:49546 seq:2339673294, ack:2965734069, flags:SA
[1567223.763763] [327d9900][ip_route_input_slow ][cpu:18 ][cali52f76ea9a5][pid:4134789][tap-0_qp0   ][ns:0] TCP: 172.27.205.149:20007 -> 76.0.145.47:49546 seq:2339673294, ack:2965734069, flags:SA
[1567223.763766] [327d9900][fib_validate_source ][cpu:18 ][cali52f76ea9a5][pid:4134789][tap-0_qp0   ][ns:0] TCP: 172.27.205.149:20007 -> 76.0.145.47:49546 seq:2339673294, ack:2965734069, flags:SA
[1567223.763769] [327d9900][ip_forward          ][cpu:18 ][cali52f76ea9a5][pid:4134789][tap-0_qp0   ][ns:0] TCP: 172.27.205.149:20007 -> 76.0.145.47:49546 seq:2339673294, ack:2965734069, flags:SA
[1567223.763771] [327d9900][nf_hook_slow        ][cpu:18 ][cali52f76ea9a5][pid:4134789][tap-0_qp0   ][ns:0] TCP: 172.27.205.149:20007 -> 76.0.145.47:49546 seq:2339673294, ack:2965734069, flags:SA *ipv4 in chain: FORWARD*
[1567223.763773] [327d9900][nft_do_chain        ][cpu:18 ][cali52f76ea9a5][pid:4134789][tap-0_qp0   ][ns:0] TCP: 172.27.205.149:20007 -> 76.0.145.47:49546 seq:2339673294, ack:2965734069, flags:SA *iptables table:filter, chain:FORWARD*
[1567223.763782] [327d9900][ip_output           ][cpu:18 ][cali52f76ea9a5][pid:4134789][tap-0_qp0   ][ns:0] TCP: 172.27.205.149:20007 -> 76.0.145.47:49546 seq:2339673294, ack:2965734069, flags:SA
[1567223.763784] [327d9900][nf_hook_slow        ][cpu:18 ][ens5f1][pid:4134789][tap-0_qp0   ][ns:0] TCP: 172.27.205.149:20007 -> 76.0.145.47:49546 seq:2339673294, ack:2965734069, flags:SA *ipv4 in chain: POST_ROUTING*
[1567223.763785] [327d9900][nft_do_chain        ][cpu:18 ][ens5f1][pid:4134789][tap-0_qp0   ][ns:0] TCP: 172.27.205.149:20007 -> 76.0.145.47:49546 seq:2339673294, ack:2965734069, flags:SA *iptables table:mangle, chain:POSTROU*
[1567223.763788] [327d9900][nf_nat_manip_pkt    ][cpu:18 ][ens5f1][pid:4134789][tap-0_qp0   ][ns:0] TCP: 172.27.205.149:20007 -> 76.0.145.47:49546 seq:2339673294, ack:2965734069, flags:SA
[1567223.763792] [327d9900][ip_finish_output    ][cpu:18 ][ens5f1][pid:4134789][tap-0_qp0   ][ns:0] TCP: 76.0.121.10:20007 -> 76.0.145.47:49546 seq:2339673294, ack:2965734069, flags:SA
[1567223.763794] [327d9900][ip_finish_output2   ][cpu:18 ][ens5f1][pid:4134789][tap-0_qp0   ][ns:0] TCP: 76.0.121.10:20007 -> 76.0.145.47:49546 seq:2339673294, ack:2965734069, flags:SA
[1567223.763797] [327d9900][__dev_queue_xmit    ][cpu:18 ][ens5f1][pid:4134789][tap-0_qp0   ][ns:0] TCP: 76.0.121.10:20007 -> 76.0.145.47:49546 seq:2339673294, ack:2965734069, flags:SA
[1567223.763800] [327d9900][dev_hard_start_xmit ][cpu:18 ][ens5f1][pid:4134789][tap-0_qp0   ][ns:0] TCP: 76.0.121.10:20007 -> 76.0.145.47:49546 seq:2339673294, ack:2965734069, flags:SA *skb is successfully sent to the NIC driver*
[1567223.763812] [327d9900][consume_skb         ][cpu:18 ][ens5f1][pid:4134789][tap-0_qp0   ][ns:0] TCP: 76.0.121.10:20007 -> 76.0.145.47:49546 seq:2339673294, ack:2965734069, flags:SA *packet is freed (normally)*

***************** 327d9900 ***************
[1567223.763906] [327d9900][ip_route_input_slow ][cpu:18 ][ens5f1][pid:0      ][swapper/18  ][ns:0] TCP: 76.0.145.47:49546 -> 172.27.205.149:20007 seq:2965734069, ack:2339673295, flags:A
[1567223.763909] [327d9900][fib_validate_source ][cpu:18 ][ens5f1][pid:0      ][swapper/18  ][ns:0] TCP: 76.0.145.47:49546 -> 172.27.205.149:20007 seq:2965734069, ack:2339673295, flags:A
[1567223.763911] [327d9900][ip_forward          ][cpu:18 ][ens5f1][pid:0      ][swapper/18  ][ns:0] TCP: 76.0.145.47:49546 -> 172.27.205.149:20007 seq:2965734069, ack:2339673295, flags:A
[1567223.763913] [327d9900][nf_hook_slow        ][cpu:18 ][ens5f1][pid:0      ][swapper/18  ][ns:0] TCP: 76.0.145.47:49546 -> 172.27.205.149:20007 seq:2965734069, ack:2339673295, flags:A *ipv4 in chain: FORWARD*
[1567223.763915] [327d9900][nft_do_chain        ][cpu:18 ][ens5f1][pid:0      ][swapper/18  ][ns:0] TCP: 76.0.145.47:49546 -> 172.27.205.149:20007 seq:2965734069, ack:2339673295, flags:A *iptables table:filter, chain:FORWARD*
[1567223.763920] [327d9900][ip_output           ][cpu:18 ][ens5f1][pid:0      ][swapper/18  ][ns:0] TCP: 76.0.145.47:49546 -> 172.27.205.149:20007 seq:2965734069, ack:2339673295, flags:A
[1567223.763922] [327d9900][nf_hook_slow        ][cpu:18 ][cali52f76ea9a5][pid:0      ][swapper/18  ][ns:0] TCP: 76.0.145.47:49546 -> 172.27.205.149:20007 seq:2965734069, ack:2339673295, flags:A *ipv4 in chain: POST_ROUTING*
[1567223.763923] [327d9900][nft_do_chain        ][cpu:18 ][cali52f76ea9a5][pid:0      ][swapper/18  ][ns:0] TCP: 76.0.145.47:49546 -> 172.27.205.149:20007 seq:2965734069, ack:2339673295, flags:A *iptables table:mangle, chain:POSTROU*
[1567223.763925] [327d9900][nf_nat_manip_pkt    ][cpu:18 ][cali52f76ea9a5][pid:0      ][swapper/18  ][ns:0] TCP: 76.0.145.47:49546 -> 172.27.205.149:20007 seq:2965734069, ack:2339673295, flags:A
[1567223.763928] [327d9900][ip_finish_output    ][cpu:18 ][cali52f76ea9a5][pid:0      ][swapper/18  ][ns:0] TCP: 76.0.121.10:49546 -> 172.27.205.149:20007 seq:2965734069, ack:2339673295, flags:A
[1567223.763930] [327d9900][ip_finish_output2   ][cpu:18 ][cali52f76ea9a5][pid:0      ][swapper/18  ][ns:0] TCP: 76.0.121.10:49546 -> 172.27.205.149:20007 seq:2965734069, ack:2339673295, flags:A
[1567223.763931] [327d9900][__dev_queue_xmit    ][cpu:18 ][cali52f76ea9a5][pid:0      ][swapper/18  ][ns:0] TCP: 76.0.121.10:49546 -> 172.27.205.149:20007 seq:2965734069, ack:2339673295, flags:A
[1567223.763934] [327d9900][dev_hard_start_xmit ][cpu:18 ][cali52f76ea9a5][pid:0      ][swapper/18  ][ns:0] TCP: 76.0.121.10:49546 -> 172.27.205.149:20007 seq:2965734069, ack:2339673295, flags:A *skb is successfully sent to the NIC driver*
[1567223.763935] [327d9900][enqueue_to_backlog  ][cpu:18 ][eth0 ][pid:0      ][swapper/18  ][ns:0] TCP: 76.0.121.10:49546 -> 172.27.205.149:20007 seq:2965734069, ack:2339673295, flags:A
[1567223.763938] [327d9900][__netif_receive_skb_core][cpu:18 ][eth0 ][pid:0      ][swapper/18  ][ns:0] TCP: 76.0.121.10:49546 -> 172.27.205.149:20007 seq:2965734069, ack:2339673295, flags:A
[1567223.763941] [327d9900][tcf_classify        ][cpu:18 ][eth0 ][pid:0      ][swapper/18  ][ns:0] TCP: 76.0.121.10:49546 -> 172.27.205.149:20007 seq:2965734069, ack:2339673295, flags:A
[1567223.763944] [327d9900][cls_bpf_classify    ][cpu:18 ][eth0 ][pid:0      ][swapper/18  ][ns:0] TCP: 76.0.121.10:49546 -> 172.27.205.149:20007 seq:2965734069, ack:2339673295, flags:A
[1567223.763947] [327d9900][__dev_queue_xmit    ][cpu:18 ][z192.168.0.3][pid:0      ][swapper/18  ][ns:0] TCP: 76.0.121.10:49546 -> 169.254.68.6:49999 seq:2965734069, ack:2339673295, flags:A
[1567223.763949] [327d9900][dev_hard_start_xmit ][cpu:18 ][z192.168.0.3][pid:0      ][swapper/18  ][ns:0] TCP: 76.0.121.10:49546 -> 169.254.68.6:49999 seq:2965734069, ack:2339673295, flags:A *skb is successfully sent to the NIC driver*
[1567223.764006] [327d9900][consume_skb         ][cpu:18 ][z192.168.0.3][pid:4134789][tap-0_qp0   ][ns:0] TCP: 76.0.121.10:49546 -> 169.254.68.6:49999 seq:2965734069, ack:2339673295, flags:A *packet is freed (normally)*

***************** f75a2940 ***************
[1567223.763960] [f75a2940][ip_route_input_slow ][cpu:18 ][ens5f1][pid:0      ][swapper/18  ][ns:0] TCP: 76.0.145.47:49546 -> 172.27.205.149:20007 seq:2965734069, ack:2339673295, flags:AP
[1567223.763963] [f75a2940][fib_validate_source ][cpu:18 ][ens5f1][pid:0      ][swapper/18  ][ns:0] TCP: 76.0.145.47:49546 -> 172.27.205.149:20007 seq:2965734069, ack:2339673295, flags:AP
[1567223.763964] [f75a2940][ip_forward          ][cpu:18 ][ens5f1][pid:0      ][swapper/18  ][ns:0] TCP: 76.0.145.47:49546 -> 172.27.205.149:20007 seq:2965734069, ack:2339673295, flags:AP
[1567223.763966] [f75a2940][nf_hook_slow        ][cpu:18 ][ens5f1][pid:0      ][swapper/18  ][ns:0] TCP: 76.0.145.47:49546 -> 172.27.205.149:20007 seq:2965734069, ack:2339673295, flags:AP *ipv4 in chain: FORWARD*
[1567223.763968] [f75a2940][nft_do_chain        ][cpu:18 ][ens5f1][pid:0      ][swapper/18  ][ns:0] TCP: 76.0.145.47:49546 -> 172.27.205.149:20007 seq:2965734069, ack:2339673295, flags:AP *iptables table:filter, chain:FORWARD*
[1567223.763971] [f75a2940][ip_output           ][cpu:18 ][ens5f1][pid:0      ][swapper/18  ][ns:0] TCP: 76.0.145.47:49546 -> 172.27.205.149:20007 seq:2965734069, ack:2339673295, flags:AP
[1567223.763972] [f75a2940][nf_hook_slow        ][cpu:18 ][cali52f76ea9a5][pid:0      ][swapper/18  ][ns:0] TCP: 76.0.145.47:49546 -> 172.27.205.149:20007 seq:2965734069, ack:2339673295, flags:AP *ipv4 in chain: POST_ROUTING*
[1567223.763974] [f75a2940][nft_do_chain        ][cpu:18 ][cali52f76ea9a5][pid:0      ][swapper/18  ][ns:0] TCP: 76.0.145.47:49546 -> 172.27.205.149:20007 seq:2965734069, ack:2339673295, flags:AP *iptables table:mangle, chain:POSTROU*
[1567223.763976] [f75a2940][nf_nat_manip_pkt    ][cpu:18 ][cali52f76ea9a5][pid:0      ][swapper/18  ][ns:0] TCP: 76.0.145.47:49546 -> 172.27.205.149:20007 seq:2965734069, ack:2339673295, flags:AP
[1567223.763978] [f75a2940][ip_finish_output    ][cpu:18 ][cali52f76ea9a5][pid:0      ][swapper/18  ][ns:0] TCP: 76.0.121.10:49546 -> 172.27.205.149:20007 seq:2965734069, ack:2339673295, flags:AP
[1567223.763980] [f75a2940][ip_finish_output2   ][cpu:18 ][cali52f76ea9a5][pid:0      ][swapper/18  ][ns:0] TCP: 76.0.121.10:49546 -> 172.27.205.149:20007 seq:2965734069, ack:2339673295, flags:AP
[1567223.763981] [f75a2940][__dev_queue_xmit    ][cpu:18 ][cali52f76ea9a5][pid:0      ][swapper/18  ][ns:0] TCP: 76.0.121.10:49546 -> 172.27.205.149:20007 seq:2965734069, ack:2339673295, flags:AP
[1567223.763983] [f75a2940][dev_hard_start_xmit ][cpu:18 ][cali52f76ea9a5][pid:0      ][swapper/18  ][ns:0] TCP: 76.0.121.10:49546 -> 172.27.205.149:20007 seq:2965734069, ack:2339673295, flags:AP *skb is successfully sent to the NIC driver*
[1567223.763984] [f75a2940][enqueue_to_backlog  ][cpu:18 ][eth0 ][pid:0      ][swapper/18  ][ns:0] TCP: 76.0.121.10:49546 -> 172.27.205.149:20007 seq:2965734069, ack:2339673295, flags:AP
[1567223.763987] [f75a2940][__netif_receive_skb_core][cpu:18 ][eth0 ][pid:0      ][swapper/18  ][ns:0] TCP: 76.0.121.10:49546 -> 172.27.205.149:20007 seq:2965734069, ack:2339673295, flags:AP
[1567223.763989] [f75a2940][tcf_classify        ][cpu:18 ][eth0 ][pid:0      ][swapper/18  ][ns:0] TCP: 76.0.121.10:49546 -> 172.27.205.149:20007 seq:2965734069, ack:2339673295, flags:AP
[1567223.763990] [f75a2940][cls_bpf_classify    ][cpu:18 ][eth0 ][pid:0      ][swapper/18  ][ns:0] TCP: 76.0.121.10:49546 -> 172.27.205.149:20007 seq:2965734069, ack:2339673295, flags:AP
[1567223.763992] [f75a2940][__dev_queue_xmit    ][cpu:18 ][z192.168.0.3][pid:0      ][swapper/18  ][ns:0] TCP: 76.0.121.10:49546 -> 169.254.68.6:49999 seq:2965734069, ack:2339673295, flags:AP
[1567223.763994] [f75a2940][dev_hard_start_xmit ][cpu:18 ][z192.168.0.3][pid:0      ][swapper/18  ][ns:0] TCP: 76.0.121.10:49546 -> 169.254.68.6:49999 seq:2965734069, ack:2339673295, flags:AP *skb is successfully sent to the NIC driver*
[1567223.764016] [f75a2940][consume_skb         ][cpu:18 ][z192.168.0.3][pid:4134789][tap-0_qp0   ][ns:0] TCP: 76.0.121.10:49546 -> 169.254.68.6:49999 seq:2965734069, ack:2339673295, flags:AP *packet is freed (normally)*

***************** 327d9900 ***************
[1567223.764088] [327d9900][__dev_queue_xmit    ][cpu:18 ][eth0 ][pid:4134789][tap-0_qp0   ][ns:0] TCP: 172.27.205.149:20007 -> 76.0.121.10:49546 seq:2339673295, ack:2965734155, flags:A
[1567223.764091] [327d9900][dev_hard_start_xmit ][cpu:18 ][eth0 ][pid:4134789][tap-0_qp0   ][ns:0] TCP: 172.27.205.149:20007 -> 76.0.121.10:49546 seq:2339673295, ack:2965734155, flags:A *skb is successfully sent to the NIC driver*
[1567223.764092] [327d9900][enqueue_to_backlog  ][cpu:18 ][cali52f76ea9a5][pid:4134789][tap-0_qp0   ][ns:0] TCP: 172.27.205.149:20007 -> 76.0.121.10:49546 seq:2339673295, ack:2965734155, flags:A
[1567223.764094] [327d9900][__netif_receive_skb_core][cpu:18 ][cali52f76ea9a5][pid:4134789][tap-0_qp0   ][ns:0] TCP: 172.27.205.149:20007 -> 76.0.121.10:49546 seq:2339673295, ack:2965734155, flags:A
[1567223.764096] [327d9900][ip_rcv              ][cpu:18 ][cali52f76ea9a5][pid:4134789][tap-0_qp0   ][ns:0] TCP: 172.27.205.149:20007 -> 76.0.121.10:49546 seq:2339673295, ack:2965734155, flags:A
[1567223.764098] [327d9900][ip_rcv_core         ][cpu:18 ][cali52f76ea9a5][pid:4134789][tap-0_qp0   ][ns:0] TCP: 172.27.205.149:20007 -> 76.0.121.10:49546 seq:2339673295, ack:2965734155, flags:A
[1567223.764100] [327d9900][nf_hook_slow        ][cpu:18 ][cali52f76ea9a5][pid:4134789][tap-0_qp0   ][ns:0] TCP: 172.27.205.149:20007 -> 76.0.121.10:49546 seq:2339673295, ack:2965734155, flags:A *ipv4 in chain: PRE_ROUTING*
[1567223.764102] [327d9900][nft_do_chain        ][cpu:18 ][cali52f76ea9a5][pid:4134789][tap-0_qp0   ][ns:0] TCP: 172.27.205.149:20007 -> 76.0.121.10:49546 seq:2339673295, ack:2965734155, flags:A *iptables table:raw, chain:PREROUT*
[1567223.764106] [327d9900][nft_do_chain        ][cpu:18 ][cali52f76ea9a5][pid:4134789][tap-0_qp0   ][ns:0] TCP: 172.27.205.149:20007 -> 76.0.121.10:49546 seq:2339673295, ack:2965734155, flags:A *iptables table:mangle, chain:PREROUT*
[1567223.764108] [327d9900][nf_nat_manip_pkt    ][cpu:18 ][cali52f76ea9a5][pid:4134789][tap-0_qp0   ][ns:0] TCP: 172.27.205.149:20007 -> 76.0.121.10:49546 seq:2339673295, ack:2965734155, flags:A
[1567223.764110] [327d9900][ip_rcv_finish       ][cpu:18 ][cali52f76ea9a5][pid:4134789][tap-0_qp0   ][ns:0] TCP: 172.27.205.149:20007 -> 76.0.145.47:49546 seq:2339673295, ack:2965734155, flags:A
[1567223.764112] [327d9900][ip_route_input_slow ][cpu:18 ][cali52f76ea9a5][pid:4134789][tap-0_qp0   ][ns:0] TCP: 172.27.205.149:20007 -> 76.0.145.47:49546 seq:2339673295, ack:2965734155, flags:A
[1567223.764114] [327d9900][fib_validate_source ][cpu:18 ][cali52f76ea9a5][pid:4134789][tap-0_qp0   ][ns:0] TCP: 172.27.205.149:20007 -> 76.0.145.47:49546 seq:2339673295, ack:2965734155, flags:A
[1567223.764116] [327d9900][ip_forward          ][cpu:18 ][cali52f76ea9a5][pid:4134789][tap-0_qp0   ][ns:0] TCP: 172.27.205.149:20007 -> 76.0.145.47:49546 seq:2339673295, ack:2965734155, flags:A
[1567223.764117] [327d9900][nf_hook_slow        ][cpu:18 ][cali52f76ea9a5][pid:4134789][tap-0_qp0   ][ns:0] TCP: 172.27.205.149:20007 -> 76.0.145.47:49546 seq:2339673295, ack:2965734155, flags:A *ipv4 in chain: FORWARD*
[1567223.764119] [327d9900][nft_do_chain        ][cpu:18 ][cali52f76ea9a5][pid:4134789][tap-0_qp0   ][ns:0] TCP: 172.27.205.149:20007 -> 76.0.145.47:49546 seq:2339673295, ack:2965734155, flags:A *iptables table:filter, chain:FORWARD*
[1567223.764122] [327d9900][ip_output           ][cpu:18 ][cali52f76ea9a5][pid:4134789][tap-0_qp0   ][ns:0] TCP: 172.27.205.149:20007 -> 76.0.145.47:49546 seq:2339673295, ack:2965734155, flags:A
[1567223.764124] [327d9900][nf_hook_slow        ][cpu:18 ][ens5f1][pid:4134789][tap-0_qp0   ][ns:0] TCP: 172.27.205.149:20007 -> 76.0.145.47:49546 seq:2339673295, ack:2965734155, flags:A *ipv4 in chain: POST_ROUTING*
[1567223.764125] [327d9900][nft_do_chain        ][cpu:18 ][ens5f1][pid:4134789][tap-0_qp0   ][ns:0] TCP: 172.27.205.149:20007 -> 76.0.145.47:49546 seq:2339673295, ack:2965734155, flags:A *iptables table:mangle, chain:POSTROU*
[1567223.764127] [327d9900][nf_nat_manip_pkt    ][cpu:18 ][ens5f1][pid:4134789][tap-0_qp0   ][ns:0] TCP: 172.27.205.149:20007 -> 76.0.145.47:49546 seq:2339673295, ack:2965734155, flags:A
[1567223.764129] [327d9900][ip_finish_output    ][cpu:18 ][ens5f1][pid:4134789][tap-0_qp0   ][ns:0] TCP: 76.0.121.10:20007 -> 76.0.145.47:49546 seq:2339673295, ack:2965734155, flags:A
[1567223.764131] [327d9900][ip_finish_output2   ][cpu:18 ][ens5f1][pid:4134789][tap-0_qp0   ][ns:0] TCP: 76.0.121.10:20007 -> 76.0.145.47:49546 seq:2339673295, ack:2965734155, flags:A
[1567223.764132] [327d9900][__dev_queue_xmit    ][cpu:18 ][ens5f1][pid:4134789][tap-0_qp0   ][ns:0] TCP: 76.0.121.10:20007 -> 76.0.145.47:49546 seq:2339673295, ack:2965734155, flags:A
[1567223.764134] [327d9900][dev_hard_start_xmit ][cpu:18 ][ens5f1][pid:4134789][tap-0_qp0   ][ns:0] TCP: 76.0.121.10:20007 -> 76.0.145.47:49546 seq:2339673295, ack:2965734155, flags:A *skb is successfully sent to the NIC driver*
[1567223.764144] [327d9900][consume_skb         ][cpu:18 ][ens5f1][pid:0      ][swapper/18  ][ns:0] TCP: 76.0.121.10:20007 -> 76.0.145.47:49546 seq:2339673295, ack:2965734155, flags:A *packet is freed (normally)*

***************** 327dad00 ***************
[1567223.764655] [327dad00][__dev_queue_xmit    ][cpu:18 ][eth0 ][pid:4134789][tap-0_qp0   ][ns:0] TCP: 172.27.205.149:20007 -> 76.0.121.10:49546 seq:2339673295, ack:2965734155, flags:AP
[1567223.764657] [327dad00][dev_hard_start_xmit ][cpu:18 ][eth0 ][pid:4134789][tap-0_qp0   ][ns:0] TCP: 172.27.205.149:20007 -> 76.0.121.10:49546 seq:2339673295, ack:2965734155, flags:AP *skb is successfully sent to the NIC driver*
[1567223.764659] [327dad00][enqueue_to_backlog  ][cpu:18 ][cali52f76ea9a5][pid:4134789][tap-0_qp0   ][ns:0] TCP: 172.27.205.149:20007 -> 76.0.121.10:49546 seq:2339673295, ack:2965734155, flags:AP
[1567223.764661] [327dad00][__netif_receive_skb_core][cpu:18 ][cali52f76ea9a5][pid:4134789][tap-0_qp0   ][ns:0] TCP: 172.27.205.149:20007 -> 76.0.121.10:49546 seq:2339673295, ack:2965734155, flags:AP
[1567223.764663] [327dad00][ip_rcv              ][cpu:18 ][cali52f76ea9a5][pid:4134789][tap-0_qp0   ][ns:0] TCP: 172.27.205.149:20007 -> 76.0.121.10:49546 seq:2339673295, ack:2965734155, flags:AP
[1567223.764665] [327dad00][ip_rcv_core         ][cpu:18 ][cali52f76ea9a5][pid:4134789][tap-0_qp0   ][ns:0] TCP: 172.27.205.149:20007 -> 76.0.121.10:49546 seq:2339673295, ack:2965734155, flags:AP
[1567223.764667] [327dad00][nf_hook_slow        ][cpu:18 ][cali52f76ea9a5][pid:4134789][tap-0_qp0   ][ns:0] TCP: 172.27.205.149:20007 -> 76.0.121.10:49546 seq:2339673295, ack:2965734155, flags:AP *ipv4 in chain: PRE_ROUTING*
[1567223.764668] [327dad00][nft_do_chain        ][cpu:18 ][cali52f76ea9a5][pid:4134789][tap-0_qp0   ][ns:0] TCP: 172.27.205.149:20007 -> 76.0.121.10:49546 seq:2339673295, ack:2965734155, flags:AP *iptables table:raw, chain:PREROUT*
[1567223.764672] [327dad00][nft_do_chain        ][cpu:18 ][cali52f76ea9a5][pid:4134789][tap-0_qp0   ][ns:0] TCP: 172.27.205.149:20007 -> 76.0.121.10:49546 seq:2339673295, ack:2965734155, flags:AP *iptables table:mangle, chain:PREROUT*
[1567223.764674] [327dad00][nf_nat_manip_pkt    ][cpu:18 ][cali52f76ea9a5][pid:4134789][tap-0_qp0   ][ns:0] TCP: 172.27.205.149:20007 -> 76.0.121.10:49546 seq:2339673295, ack:2965734155, flags:AP
[1567223.764676] [327dad00][ip_rcv_finish       ][cpu:18 ][cali52f76ea9a5][pid:4134789][tap-0_qp0   ][ns:0] TCP: 172.27.205.149:20007 -> 76.0.145.47:49546 seq:2339673295, ack:2965734155, flags:AP
[1567223.764677] [327dad00][ip_route_input_slow ][cpu:18 ][cali52f76ea9a5][pid:4134789][tap-0_qp0   ][ns:0] TCP: 172.27.205.149:20007 -> 76.0.145.47:49546 seq:2339673295, ack:2965734155, flags:AP
[1567223.764680] [327dad00][fib_validate_source ][cpu:18 ][cali52f76ea9a5][pid:4134789][tap-0_qp0   ][ns:0] TCP: 172.27.205.149:20007 -> 76.0.145.47:49546 seq:2339673295, ack:2965734155, flags:AP
[1567223.764681] [327dad00][ip_forward          ][cpu:18 ][cali52f76ea9a5][pid:4134789][tap-0_qp0   ][ns:0] TCP: 172.27.205.149:20007 -> 76.0.145.47:49546 seq:2339673295, ack:2965734155, flags:AP
[1567223.764682] [327dad00][nf_hook_slow        ][cpu:18 ][cali52f76ea9a5][pid:4134789][tap-0_qp0   ][ns:0] TCP: 172.27.205.149:20007 -> 76.0.145.47:49546 seq:2339673295, ack:2965734155, flags:AP *ipv4 in chain: FORWARD*
[1567223.764684] [327dad00][nft_do_chain        ][cpu:18 ][cali52f76ea9a5][pid:4134789][tap-0_qp0   ][ns:0] TCP: 172.27.205.149:20007 -> 76.0.145.47:49546 seq:2339673295, ack:2965734155, flags:AP *iptables table:filter, chain:FORWARD*
[1567223.764687] [327dad00][ip_output           ][cpu:18 ][cali52f76ea9a5][pid:4134789][tap-0_qp0   ][ns:0] TCP: 172.27.205.149:20007 -> 76.0.145.47:49546 seq:2339673295, ack:2965734155, flags:AP
[1567223.764689] [327dad00][nf_hook_slow        ][cpu:18 ][ens5f1][pid:4134789][tap-0_qp0   ][ns:0] TCP: 172.27.205.149:20007 -> 76.0.145.47:49546 seq:2339673295, ack:2965734155, flags:AP *ipv4 in chain: POST_ROUTING*
[1567223.764691] [327dad00][nft_do_chain        ][cpu:18 ][ens5f1][pid:4134789][tap-0_qp0   ][ns:0] TCP: 172.27.205.149:20007 -> 76.0.145.47:49546 seq:2339673295, ack:2965734155, flags:AP *iptables table:mangle, chain:POSTROU*
[1567223.764694] [327dad00][nf_nat_manip_pkt    ][cpu:18 ][ens5f1][pid:4134789][tap-0_qp0   ][ns:0] TCP: 172.27.205.149:20007 -> 76.0.145.47:49546 seq:2339673295, ack:2965734155, flags:AP
[1567223.764697] [327dad00][ip_finish_output    ][cpu:18 ][ens5f1][pid:4134789][tap-0_qp0   ][ns:0] TCP: 76.0.121.10:20007 -> 76.0.145.47:49546 seq:2339673295, ack:2965734155, flags:AP
[1567223.764698] [327dad00][ip_finish_output2   ][cpu:18 ][ens5f1][pid:4134789][tap-0_qp0   ][ns:0] TCP: 76.0.121.10:20007 -> 76.0.145.47:49546 seq:2339673295, ack:2965734155, flags:AP
[1567223.764700] [327dad00][__dev_queue_xmit    ][cpu:18 ][ens5f1][pid:4134789][tap-0_qp0   ][ns:0] TCP: 76.0.121.10:20007 -> 76.0.145.47:49546 seq:2339673295, ack:2965734155, flags:AP
[1567223.764702] [327dad00][dev_hard_start_xmit ][cpu:18 ][ens5f1][pid:4134789][tap-0_qp0   ][ns:0] TCP: 76.0.121.10:20007 -> 76.0.145.47:49546 seq:2339673295, ack:2965734155, flags:AP *skb is successfully sent to the NIC driver*
[1567223.764712] [327dad00][consume_skb         ][cpu:18 ][ens5f1][pid:0      ][swapper/18  ][ns:0] TCP: 76.0.121.10:20007 -> 76.0.145.47:49546 seq:2339673295, ack:2965734155, flags:AP *packet is freed (normally)*

***************** 327dad00 ***************
[1567223.764769] [327dad00][ip_route_input_slow ][cpu:18 ][ens5f1][pid:0      ][swapper/18  ][ns:0] TCP: 76.0.145.47:49546 -> 172.27.205.149:20007 seq:2965734155, ack:2339673423, flags:A
[1567223.764772] [327dad00][fib_validate_source ][cpu:18 ][ens5f1][pid:0      ][swapper/18  ][ns:0] TCP: 76.0.145.47:49546 -> 172.27.205.149:20007 seq:2965734155, ack:2339673423, flags:A
[1567223.764773] [327dad00][ip_forward          ][cpu:18 ][ens5f1][pid:0      ][swapper/18  ][ns:0] TCP: 76.0.145.47:49546 -> 172.27.205.149:20007 seq:2965734155, ack:2339673423, flags:A
[1567223.764775] [327dad00][nf_hook_slow        ][cpu:18 ][ens5f1][pid:0      ][swapper/18  ][ns:0] TCP: 76.0.145.47:49546 -> 172.27.205.149:20007 seq:2965734155, ack:2339673423, flags:A *ipv4 in chain: FORWARD*
[1567223.764777] [327dad00][nft_do_chain        ][cpu:18 ][ens5f1][pid:0      ][swapper/18  ][ns:0] TCP: 76.0.145.47:49546 -> 172.27.205.149:20007 seq:2965734155, ack:2339673423, flags:A *iptables table:filter, chain:FORWARD*
[1567223.764780] [327dad00][ip_output           ][cpu:18 ][ens5f1][pid:0      ][swapper/18  ][ns:0] TCP: 76.0.145.47:49546 -> 172.27.205.149:20007 seq:2965734155, ack:2339673423, flags:A
[1567223.764782] [327dad00][nf_hook_slow        ][cpu:18 ][cali52f76ea9a5][pid:0      ][swapper/18  ][ns:0] TCP: 76.0.145.47:49546 -> 172.27.205.149:20007 seq:2965734155, ack:2339673423, flags:A *ipv4 in chain: POST_ROUTING*
[1567223.764784] [327dad00][nft_do_chain        ][cpu:18 ][cali52f76ea9a5][pid:0      ][swapper/18  ][ns:0] TCP: 76.0.145.47:49546 -> 172.27.205.149:20007 seq:2965734155, ack:2339673423, flags:A *iptables table:mangle, chain:POSTROU*
[1567223.764786] [327dad00][nf_nat_manip_pkt    ][cpu:18 ][cali52f76ea9a5][pid:0      ][swapper/18  ][ns:0] TCP: 76.0.145.47:49546 -> 172.27.205.149:20007 seq:2965734155, ack:2339673423, flags:A
[1567223.764788] [327dad00][ip_finish_output    ][cpu:18 ][cali52f76ea9a5][pid:0      ][swapper/18  ][ns:0] TCP: 76.0.121.10:49546 -> 172.27.205.149:20007 seq:2965734155, ack:2339673423, flags:A
[1567223.764790] [327dad00][ip_finish_output2   ][cpu:18 ][cali52f76ea9a5][pid:0      ][swapper/18  ][ns:0] TCP: 76.0.121.10:49546 -> 172.27.205.149:20007 seq:2965734155, ack:2339673423, flags:A
[1567223.764791] [327dad00][__dev_queue_xmit    ][cpu:18 ][cali52f76ea9a5][pid:0      ][swapper/18  ][ns:0] TCP: 76.0.121.10:49546 -> 172.27.205.149:20007 seq:2965734155, ack:2339673423, flags:A
[1567223.764793] [327dad00][dev_hard_start_xmit ][cpu:18 ][cali52f76ea9a5][pid:0      ][swapper/18  ][ns:0] TCP: 76.0.121.10:49546 -> 172.27.205.149:20007 seq:2965734155, ack:2339673423, flags:A *skb is successfully sent to the NIC driver*
[1567223.764796] [327dad00][enqueue_to_backlog  ][cpu:18 ][eth0 ][pid:0      ][swapper/18  ][ns:0] TCP: 76.0.121.10:49546 -> 172.27.205.149:20007 seq:2965734155, ack:2339673423, flags:A
[1567223.764798] [327dad00][__netif_receive_skb_core][cpu:18 ][eth0 ][pid:0      ][swapper/18  ][ns:0] TCP: 76.0.121.10:49546 -> 172.27.205.149:20007 seq:2965734155, ack:2339673423, flags:A
[1567223.764800] [327dad00][tcf_classify        ][cpu:18 ][eth0 ][pid:0      ][swapper/18  ][ns:0] TCP: 76.0.121.10:49546 -> 172.27.205.149:20007 seq:2965734155, ack:2339673423, flags:A
[1567223.764802] [327dad00][cls_bpf_classify    ][cpu:18 ][eth0 ][pid:0      ][swapper/18  ][ns:0] TCP: 76.0.121.10:49546 -> 172.27.205.149:20007 seq:2965734155, ack:2339673423, flags:A
[1567223.764803] [327dad00][__dev_queue_xmit    ][cpu:18 ][z192.168.0.3][pid:0      ][swapper/18  ][ns:0] TCP: 76.0.121.10:49546 -> 169.254.68.6:49999 seq:2965734155, ack:2339673423, flags:A
[1567223.764805] [327dad00][dev_hard_start_xmit ][cpu:18 ][z192.168.0.3][pid:0      ][swapper/18  ][ns:0] TCP: 76.0.121.10:49546 -> 169.254.68.6:49999 seq:2965734155, ack:2339673423, flags:A *skb is successfully sent to the NIC driver*
[1567223.764813] [327dad00][consume_skb         ][cpu:18 ][z192.168.0.3][pid:4134789][tap-0_qp0   ][ns:0] TCP: 76.0.121.10:49546 -> 169.254.68.6:49999 seq:2965734155, ack:2339673423, flags:A *packet is freed (normally)*

***************** 327d9900 ***************
[1567223.764893] [327d9900][ip_route_input_slow ][cpu:18 ][ens5f1][pid:0      ][swapper/18  ][ns:0] TCP: 76.0.145.47:49546 -> 172.27.205.149:20007 seq:2965734155, ack:2339673423, flags:AF
[1567223.764896] [327d9900][fib_validate_source ][cpu:18 ][ens5f1][pid:0      ][swapper/18  ][ns:0] TCP: 76.0.145.47:49546 -> 172.27.205.149:20007 seq:2965734155, ack:2339673423, flags:AF
[1567223.764898] [327d9900][ip_forward          ][cpu:18 ][ens5f1][pid:0      ][swapper/18  ][ns:0] TCP: 76.0.145.47:49546 -> 172.27.205.149:20007 seq:2965734155, ack:2339673423, flags:AF
[1567223.764899] [327d9900][nf_hook_slow        ][cpu:18 ][ens5f1][pid:0      ][swapper/18  ][ns:0] TCP: 76.0.145.47:49546 -> 172.27.205.149:20007 seq:2965734155, ack:2339673423, flags:AF *ipv4 in chain: FORWARD*
[1567223.764901] [327d9900][nft_do_chain        ][cpu:18 ][ens5f1][pid:0      ][swapper/18  ][ns:0] TCP: 76.0.145.47:49546 -> 172.27.205.149:20007 seq:2965734155, ack:2339673423, flags:AF *iptables table:filter, chain:FORWARD*
[1567223.764905] [327d9900][ip_output           ][cpu:18 ][ens5f1][pid:0      ][swapper/18  ][ns:0] TCP: 76.0.145.47:49546 -> 172.27.205.149:20007 seq:2965734155, ack:2339673423, flags:AF
[1567223.764906] [327d9900][nf_hook_slow        ][cpu:18 ][cali52f76ea9a5][pid:0      ][swapper/18  ][ns:0] TCP: 76.0.145.47:49546 -> 172.27.205.149:20007 seq:2965734155, ack:2339673423, flags:AF *ipv4 in chain: POST_ROUTING*
[1567223.764908] [327d9900][nft_do_chain        ][cpu:18 ][cali52f76ea9a5][pid:0      ][swapper/18  ][ns:0] TCP: 76.0.145.47:49546 -> 172.27.205.149:20007 seq:2965734155, ack:2339673423, flags:AF *iptables table:mangle, chain:POSTROU*
[1567223.764910] [327d9900][nf_nat_manip_pkt    ][cpu:18 ][cali52f76ea9a5][pid:0      ][swapper/18  ][ns:0] TCP: 76.0.145.47:49546 -> 172.27.205.149:20007 seq:2965734155, ack:2339673423, flags:AF
[1567223.764912] [327d9900][ip_finish_output    ][cpu:18 ][cali52f76ea9a5][pid:0      ][swapper/18  ][ns:0] TCP: 76.0.121.10:49546 -> 172.27.205.149:20007 seq:2965734155, ack:2339673423, flags:AF
[1567223.764914] [327d9900][ip_finish_output2   ][cpu:18 ][cali52f76ea9a5][pid:0      ][swapper/18  ][ns:0] TCP: 76.0.121.10:49546 -> 172.27.205.149:20007 seq:2965734155, ack:2339673423, flags:AF
[1567223.764916] [327d9900][__dev_queue_xmit    ][cpu:18 ][cali52f76ea9a5][pid:0      ][swapper/18  ][ns:0] TCP: 76.0.121.10:49546 -> 172.27.205.149:20007 seq:2965734155, ack:2339673423, flags:AF
[1567223.764918] [327d9900][dev_hard_start_xmit ][cpu:18 ][cali52f76ea9a5][pid:0      ][swapper/18  ][ns:0] TCP: 76.0.121.10:49546 -> 172.27.205.149:20007 seq:2965734155, ack:2339673423, flags:AF *skb is successfully sent to the NIC driver*
[1567223.764920] [327d9900][enqueue_to_backlog  ][cpu:18 ][eth0 ][pid:0      ][swapper/18  ][ns:0] TCP: 76.0.121.10:49546 -> 172.27.205.149:20007 seq:2965734155, ack:2339673423, flags:AF
[1567223.764922] [327d9900][__netif_receive_skb_core][cpu:18 ][eth0 ][pid:0      ][swapper/18  ][ns:0] TCP: 76.0.121.10:49546 -> 172.27.205.149:20007 seq:2965734155, ack:2339673423, flags:AF
[1567223.764923] [327d9900][tcf_classify        ][cpu:18 ][eth0 ][pid:0      ][swapper/18  ][ns:0] TCP: 76.0.121.10:49546 -> 172.27.205.149:20007 seq:2965734155, ack:2339673423, flags:AF
[1567223.764925] [327d9900][cls_bpf_classify    ][cpu:18 ][eth0 ][pid:0      ][swapper/18  ][ns:0] TCP: 76.0.121.10:49546 -> 172.27.205.149:20007 seq:2965734155, ack:2339673423, flags:AF
[1567223.764927] [327d9900][__dev_queue_xmit    ][cpu:18 ][z192.168.0.3][pid:0      ][swapper/18  ][ns:0] TCP: 76.0.121.10:49546 -> 169.254.68.6:49999 seq:2965734155, ack:2339673423, flags:AF
[1567223.764928] [327d9900][dev_hard_start_xmit ][cpu:18 ][z192.168.0.3][pid:0      ][swapper/18  ][ns:0] TCP: 76.0.121.10:49546 -> 169.254.68.6:49999 seq:2965734155, ack:2339673423, flags:AF *skb is successfully sent to the NIC driver*
[1567223.764935] [327d9900][consume_skb         ][cpu:18 ][z192.168.0.3][pid:4134789][tap-0_qp0   ][ns:0] TCP: 76.0.121.10:49546 -> 169.254.68.6:49999 seq:2965734155, ack:2339673423, flags:AF *packet is freed (normally)*

***************** 327d9900 ***************
[1567223.765043] [327d9900][__dev_queue_xmit    ][cpu:18 ][eth0 ][pid:4134789][tap-0_qp0   ][ns:0] TCP: 172.27.205.149:20007 -> 76.0.121.10:49546 seq:2339673423, ack:2965734156, flags:AF
[1567223.765046] [327d9900][dev_hard_start_xmit ][cpu:18 ][eth0 ][pid:4134789][tap-0_qp0   ][ns:0] TCP: 172.27.205.149:20007 -> 76.0.121.10:49546 seq:2339673423, ack:2965734156, flags:AF *skb is successfully sent to the NIC driver*
[1567223.765047] [327d9900][enqueue_to_backlog  ][cpu:18 ][cali52f76ea9a5][pid:4134789][tap-0_qp0   ][ns:0] TCP: 172.27.205.149:20007 -> 76.0.121.10:49546 seq:2339673423, ack:2965734156, flags:AF
[1567223.765049] [327d9900][__netif_receive_skb_core][cpu:18 ][cali52f76ea9a5][pid:4134789][tap-0_qp0   ][ns:0] TCP: 172.27.205.149:20007 -> 76.0.121.10:49546 seq:2339673423, ack:2965734156, flags:AF
[1567223.765051] [327d9900][ip_rcv              ][cpu:18 ][cali52f76ea9a5][pid:4134789][tap-0_qp0   ][ns:0] TCP: 172.27.205.149:20007 -> 76.0.121.10:49546 seq:2339673423, ack:2965734156, flags:AF
[1567223.765053] [327d9900][ip_rcv_core         ][cpu:18 ][cali52f76ea9a5][pid:4134789][tap-0_qp0   ][ns:0] TCP: 172.27.205.149:20007 -> 76.0.121.10:49546 seq:2339673423, ack:2965734156, flags:AF
[1567223.765055] [327d9900][nf_hook_slow        ][cpu:18 ][cali52f76ea9a5][pid:4134789][tap-0_qp0   ][ns:0] TCP: 172.27.205.149:20007 -> 76.0.121.10:49546 seq:2339673423, ack:2965734156, flags:AF *ipv4 in chain: PRE_ROUTING*
[1567223.765057] [327d9900][nft_do_chain        ][cpu:18 ][cali52f76ea9a5][pid:4134789][tap-0_qp0   ][ns:0] TCP: 172.27.205.149:20007 -> 76.0.121.10:49546 seq:2339673423, ack:2965734156, flags:AF *iptables table:raw, chain:PREROUT*
[1567223.765061] [327d9900][nft_do_chain        ][cpu:18 ][cali52f76ea9a5][pid:4134789][tap-0_qp0   ][ns:0] TCP: 172.27.205.149:20007 -> 76.0.121.10:49546 seq:2339673423, ack:2965734156, flags:AF *iptables table:mangle, chain:PREROUT*
[1567223.765063] [327d9900][nf_nat_manip_pkt    ][cpu:18 ][cali52f76ea9a5][pid:4134789][tap-0_qp0   ][ns:0] TCP: 172.27.205.149:20007 -> 76.0.121.10:49546 seq:2339673423, ack:2965734156, flags:AF
[1567223.765064] [327d9900][ip_rcv_finish       ][cpu:18 ][cali52f76ea9a5][pid:4134789][tap-0_qp0   ][ns:0] TCP: 172.27.205.149:20007 -> 76.0.145.47:49546 seq:2339673423, ack:2965734156, flags:AF
[1567223.765066] [327d9900][ip_route_input_slow ][cpu:18 ][cali52f76ea9a5][pid:4134789][tap-0_qp0   ][ns:0] TCP: 172.27.205.149:20007 -> 76.0.145.47:49546 seq:2339673423, ack:2965734156, flags:AF
[1567223.765067] [327d9900][fib_validate_source ][cpu:18 ][cali52f76ea9a5][pid:4134789][tap-0_qp0   ][ns:0] TCP: 172.27.205.149:20007 -> 76.0.145.47:49546 seq:2339673423, ack:2965734156, flags:AF
[1567223.765070] [327d9900][ip_forward          ][cpu:18 ][cali52f76ea9a5][pid:4134789][tap-0_qp0   ][ns:0] TCP: 172.27.205.149:20007 -> 76.0.145.47:49546 seq:2339673423, ack:2965734156, flags:AF
[1567223.765071] [327d9900][nf_hook_slow        ][cpu:18 ][cali52f76ea9a5][pid:4134789][tap-0_qp0   ][ns:0] TCP: 172.27.205.149:20007 -> 76.0.145.47:49546 seq:2339673423, ack:2965734156, flags:AF *ipv4 in chain: FORWARD*
[1567223.765072] [327d9900][nft_do_chain        ][cpu:18 ][cali52f76ea9a5][pid:4134789][tap-0_qp0   ][ns:0] TCP: 172.27.205.149:20007 -> 76.0.145.47:49546 seq:2339673423, ack:2965734156, flags:AF *iptables table:filter, chain:FORWARD*
[1567223.765075] [327d9900][ip_output           ][cpu:18 ][cali52f76ea9a5][pid:4134789][tap-0_qp0   ][ns:0] TCP: 172.27.205.149:20007 -> 76.0.145.47:49546 seq:2339673423, ack:2965734156, flags:AF
[1567223.765077] [327d9900][nf_hook_slow        ][cpu:18 ][ens5f1][pid:4134789][tap-0_qp0   ][ns:0] TCP: 172.27.205.149:20007 -> 76.0.145.47:49546 seq:2339673423, ack:2965734156, flags:AF *ipv4 in chain: POST_ROUTING*
[1567223.765078] [327d9900][nft_do_chain        ][cpu:18 ][ens5f1][pid:4134789][tap-0_qp0   ][ns:0] TCP: 172.27.205.149:20007 -> 76.0.145.47:49546 seq:2339673423, ack:2965734156, flags:AF *iptables table:mangle, chain:POSTROU*
[1567223.765080] [327d9900][nf_nat_manip_pkt    ][cpu:18 ][ens5f1][pid:4134789][tap-0_qp0   ][ns:0] TCP: 172.27.205.149:20007 -> 76.0.145.47:49546 seq:2339673423, ack:2965734156, flags:AF
[1567223.765082] [327d9900][ip_finish_output    ][cpu:18 ][ens5f1][pid:4134789][tap-0_qp0   ][ns:0] TCP: 76.0.121.10:20007 -> 76.0.145.47:49546 seq:2339673423, ack:2965734156, flags:AF
[1567223.765083] [327d9900][ip_finish_output2   ][cpu:18 ][ens5f1][pid:4134789][tap-0_qp0   ][ns:0] TCP: 76.0.121.10:20007 -> 76.0.145.47:49546 seq:2339673423, ack:2965734156, flags:AF
[1567223.765085] [327d9900][__dev_queue_xmit    ][cpu:18 ][ens5f1][pid:4134789][tap-0_qp0   ][ns:0] TCP: 76.0.121.10:20007 -> 76.0.145.47:49546 seq:2339673423, ack:2965734156, flags:AF
[1567223.765086] [327d9900][dev_hard_start_xmit ][cpu:18 ][ens5f1][pid:4134789][tap-0_qp0   ][ns:0] TCP: 76.0.121.10:20007 -> 76.0.145.47:49546 seq:2339673423, ack:2965734156, flags:AF *skb is successfully sent to the NIC driver*
[1567223.765095] [327d9900][consume_skb         ][cpu:18 ][ens5f1][pid:4134789][tap-0_qp0   ][ns:0] TCP: 76.0.121.10:20007 -> 76.0.145.47:49546 seq:2339673423, ack:2965734156, flags:AF *packet is freed (normally)*

***************** 327d9900 ***************
[1567223.765156] [327d9900][ip_route_input_slow ][cpu:18 ][ens5f1][pid:0      ][swapper/18  ][ns:0] TCP: 76.0.145.47:49546 -> 172.27.205.149:20007 seq:2965734156, ack:2339673424, flags:A
[1567223.765158] [327d9900][fib_validate_source ][cpu:18 ][ens5f1][pid:0      ][swapper/18  ][ns:0] TCP: 76.0.145.47:49546 -> 172.27.205.149:20007 seq:2965734156, ack:2339673424, flags:A
[1567223.765160] [327d9900][ip_forward          ][cpu:18 ][ens5f1][pid:0      ][swapper/18  ][ns:0] TCP: 76.0.145.47:49546 -> 172.27.205.149:20007 seq:2965734156, ack:2339673424, flags:A
[1567223.765161] [327d9900][nf_hook_slow        ][cpu:18 ][ens5f1][pid:0      ][swapper/18  ][ns:0] TCP: 76.0.145.47:49546 -> 172.27.205.149:20007 seq:2965734156, ack:2339673424, flags:A *ipv4 in chain: FORWARD*
[1567223.765163] [327d9900][nft_do_chain        ][cpu:18 ][ens5f1][pid:0      ][swapper/18  ][ns:0] TCP: 76.0.145.47:49546 -> 172.27.205.149:20007 seq:2965734156, ack:2339673424, flags:A *iptables table:filter, chain:FORWARD*
[1567223.765167] [327d9900][ip_output           ][cpu:18 ][ens5f1][pid:0      ][swapper/18  ][ns:0] TCP: 76.0.145.47:49546 -> 172.27.205.149:20007 seq:2965734156, ack:2339673424, flags:A
[1567223.765168] [327d9900][nf_hook_slow        ][cpu:18 ][cali52f76ea9a5][pid:0      ][swapper/18  ][ns:0] TCP: 76.0.145.47:49546 -> 172.27.205.149:20007 seq:2965734156, ack:2339673424, flags:A *ipv4 in chain: POST_ROUTING*
[1567223.765170] [327d9900][nft_do_chain        ][cpu:18 ][cali52f76ea9a5][pid:0      ][swapper/18  ][ns:0] TCP: 76.0.145.47:49546 -> 172.27.205.149:20007 seq:2965734156, ack:2339673424, flags:A *iptables table:mangle, chain:POSTROU*
[1567223.765172] [327d9900][nf_nat_manip_pkt    ][cpu:18 ][cali52f76ea9a5][pid:0      ][swapper/18  ][ns:0] TCP: 76.0.145.47:49546 -> 172.27.205.149:20007 seq:2965734156, ack:2339673424, flags:A
[1567223.765174] [327d9900][ip_finish_output    ][cpu:18 ][cali52f76ea9a5][pid:0      ][swapper/18  ][ns:0] TCP: 76.0.121.10:49546 -> 172.27.205.149:20007 seq:2965734156, ack:2339673424, flags:A
[1567223.765176] [327d9900][ip_finish_output2   ][cpu:18 ][cali52f76ea9a5][pid:0      ][swapper/18  ][ns:0] TCP: 76.0.121.10:49546 -> 172.27.205.149:20007 seq:2965734156, ack:2339673424, flags:A
[1567223.765178] [327d9900][__dev_queue_xmit    ][cpu:18 ][cali52f76ea9a5][pid:0      ][swapper/18  ][ns:0] TCP: 76.0.121.10:49546 -> 172.27.205.149:20007 seq:2965734156, ack:2339673424, flags:A
[1567223.765179] [327d9900][dev_hard_start_xmit ][cpu:18 ][cali52f76ea9a5][pid:0      ][swapper/18  ][ns:0] TCP: 76.0.121.10:49546 -> 172.27.205.149:20007 seq:2965734156, ack:2339673424, flags:A *skb is successfully sent to the NIC driver*
[1567223.765181] [327d9900][enqueue_to_backlog  ][cpu:18 ][eth0 ][pid:0      ][swapper/18  ][ns:0] TCP: 76.0.121.10:49546 -> 172.27.205.149:20007 seq:2965734156, ack:2339673424, flags:A
[1567223.765183] [327d9900][__netif_receive_skb_core][cpu:18 ][eth0 ][pid:0      ][swapper/18  ][ns:0] TCP: 76.0.121.10:49546 -> 172.27.205.149:20007 seq:2965734156, ack:2339673424, flags:A
[1567223.765185] [327d9900][tcf_classify        ][cpu:18 ][eth0 ][pid:0      ][swapper/18  ][ns:0] TCP: 76.0.121.10:49546 -> 172.27.205.149:20007 seq:2965734156, ack:2339673424, flags:A
[1567223.765187] [327d9900][cls_bpf_classify    ][cpu:18 ][eth0 ][pid:0      ][swapper/18  ][ns:0] TCP: 76.0.121.10:49546 -> 172.27.205.149:20007 seq:2965734156, ack:2339673424, flags:A
[1567223.765188] [327d9900][__dev_queue_xmit    ][cpu:18 ][z192.168.0.3][pid:0      ][swapper/18  ][ns:0] TCP: 76.0.121.10:49546 -> 169.254.68.6:49999 seq:2965734156, ack:2339673424, flags:A
[1567223.765190] [327d9900][dev_hard_start_xmit ][cpu:18 ][z192.168.0.3][pid:0      ][swapper/18  ][ns:0] TCP: 76.0.121.10:49546 -> 169.254.68.6:49999 seq:2965734156, ack:2339673424, flags:A *skb is successfully sent to the NIC driver*
[1567223.765198] [327d9900][consume_skb         ][cpu:18 ][z192.168.0.3][pid:4134789][tap-0_qp0   ][ns:0] TCP: 76.0.121.10:49546 -> 169.254.68.6:49999 seq:2965734156, ack:2339673424, flags:A *packet is freed (normally)*

**Comment by wwthw** [comment]
Within the same pod container on the same node, via podip:20007

[root@master bpf]# nettrace  --addr 172.27.205.149 --port 20007 --detail
begin trace...
***************** fbc24380,fbc24488,4b6161c0,fbc24488,fbc24488,fbc24488,fbc24488 ***************
[1630259.258526] [fbc24380][__tcp_transmit_skb  ][cpu:16 ][     ][pid:1637198][curl        ][ns:0] TCP: 172.27.205.177:37410 -> 172.27.205.149:20007 seq:3344869775, ack:0, flags:S
[1630259.258537] [fbc24380][skb_clone           ][cpu:16 ][     ][pid:1637198][curl        ][ns:0] unknow
[1630259.258542] [fbc24488][__ip_queue_xmit     ][cpu:16 ][     ][pid:1637198][curl        ][ns:0] TCP: 172.27.205.177:37410 -> 172.27.205.149:20007 seq:3344869775, ack:0, flags:S
[1630259.258544] [fbc24488][__ip_local_out      ][cpu:16 ][     ][pid:1637198][curl        ][ns:0] TCP: 172.27.205.177:37410 -> 172.27.205.149:20007 seq:3344869775, ack:0, flags:S
[1630259.258547] [fbc24488][nf_hook_slow        ][cpu:16 ][     ][pid:1637198][curl        ][ns:0] TCP: 172.27.205.177:37410 -> 172.27.205.149:20007 seq:3344869775, ack:0, flags:S *ipv4 in chain: OUTPUT*
[1630259.258549] [fbc24488][ip_output           ][cpu:16 ][     ][pid:1637198][curl        ][ns:0] TCP: 172.27.205.177:37410 -> 172.27.205.149:20007 seq:3344869775, ack:0, flags:S
[1630259.258550] [fbc24488][nf_hook_slow        ][cpu:16 ][eth0 ][pid:1637198][curl        ][ns:0] TCP: 172.27.205.177:37410 -> 172.27.205.149:20007 seq:3344869775, ack:0, flags:S *ipv4 in chain: POST_ROUTING*
[1630259.258553] [fbc24488][ip_finish_output    ][cpu:16 ][eth0 ][pid:1637198][curl        ][ns:0] TCP: 172.27.205.177:37410 -> 172.27.205.149:20007 seq:3344869775, ack:0, flags:S
[1630259.258555] [fbc24488][ip_finish_output2   ][cpu:16 ][eth0 ][pid:1637198][curl        ][ns:0] TCP: 172.27.205.177:37410 -> 172.27.205.149:20007 seq:3344869775, ack:0, flags:S
[1630259.258557] [fbc24488][__dev_queue_xmit    ][cpu:16 ][eth0 ][pid:1637198][curl        ][ns:0] TCP: 172.27.205.177:37410 -> 172.27.205.149:20007 seq:3344869775, ack:0, flags:S
[1630259.258560] [fbc24488][dev_hard_start_xmit ][cpu:16 ][eth0 ][pid:1637198][curl        ][ns:0] TCP: 172.27.205.177:37410 -> 172.27.205.149:20007 seq:3344869775, ack:0, flags:S *skb is successfully sent to the NIC driver*
[1630259.258563] [fbc24488][enqueue_to_backlog  ][cpu:16 ][calie858e8b922][pid:1637198][curl        ][ns:0] TCP: 172.27.205.177:37410 -> 172.27.205.149:20007 seq:3344869775, ack:0, flags:S
[1630259.258566] [fbc24488][__netif_receive_skb_core][cpu:16 ][calie858e8b922][pid:1637198][curl        ][ns:0] TCP: 172.27.205.177:37410 -> 172.27.205.149:20007 seq:3344869775, ack:0, flags:S
[1630259.258569] [fbc24488][ip_rcv              ][cpu:16 ][calie858e8b922][pid:1637198][curl        ][ns:0] TCP: 172.27.205.177:37410 -> 172.27.205.149:20007 seq:3344869775, ack:0, flags:S
[1630259.258571] [fbc24488][ip_rcv_core         ][cpu:16 ][calie858e8b922][pid:1637198][curl        ][ns:0] TCP: 172.27.205.177:37410 -> 172.27.205.149:20007 seq:3344869775, ack:0, flags:S
[1630259.258573] [fbc24488][nf_hook_slow        ][cpu:16 ][calie858e8b922][pid:1637198][curl        ][ns:0] TCP: 172.27.205.177:37410 -> 172.27.205.149:20007 seq:3344869775, ack:0, flags:S *ipv4 in chain: PRE_ROUTING*
[1630259.258575] [fbc24488][nft_do_chain        ][cpu:16 ][calie858e8b922][pid:1637198][curl        ][ns:0] TCP: 172.27.205.177:37410 -> 172.27.205.149:20007 seq:3344869775, ack:0, flags:S *iptables table:raw, chain:PREROUT*
[1630259.258584] [fbc24488][nft_do_chain        ][cpu:16 ][calie858e8b922][pid:1637198][curl        ][ns:0] TCP: 172.27.205.177:37410 -> 172.27.205.149:20007 seq:3344869775, ack:0, flags:S *iptables table:mangle, chain:PREROUT*
[1630259.258588] [fbc24488][nft_do_chain        ][cpu:16 ][calie858e8b922][pid:1637198][curl        ][ns:0] TCP: 172.27.205.177:37410 -> 172.27.205.149:20007 seq:3344869775, ack:0, flags:S *iptables table:nat, chain:PREROUT*
[1630259.258595] [fbc24488][ip_rcv_finish       ][cpu:16 ][calie858e8b922][pid:1637198][curl        ][ns:0] TCP: 172.27.205.177:37410 -> 172.27.205.149:20007 seq:3344869775, ack:0, flags:S
[1630259.258598] [fbc24488][ip_route_input_slow ][cpu:16 ][calie858e8b922][pid:1637198][curl        ][ns:0] TCP: 172.27.205.177:37410 -> 172.27.205.149:20007 seq:3344869775, ack:0, flags:S
[1630259.258600] [fbc24488][fib_validate_source ][cpu:16 ][calie858e8b922][pid:1637198][curl        ][ns:0] TCP: 172.27.205.177:37410 -> 172.27.205.149:20007 seq:3344869775, ack:0, flags:S
[1630259.258604] [fbc24488][ip_forward          ][cpu:16 ][calie858e8b922][pid:1637198][curl        ][ns:0] TCP: 172.27.205.177:37410 -> 172.27.205.149:20007 seq:3344869775, ack:0, flags:S
[1630259.258606] [fbc24488][nf_hook_slow        ][cpu:16 ][calie858e8b922][pid:1637198][curl        ][ns:0] TCP: 172.27.205.177:37410 -> 172.27.205.149:20007 seq:3344869775, ack:0, flags:S *ipv4 in chain: FORWARD*
[1630259.258608] [fbc24488][nft_do_chain        ][cpu:16 ][calie858e8b922][pid:1637198][curl        ][ns:0] TCP: 172.27.205.177:37410 -> 172.27.205.149:20007 seq:3344869775, ack:0, flags:S *iptables table:filter, chain:FORWARD*
[1630259.258628] [fbc24488][ip_output           ][cpu:16 ][calie858e8b922][pid:1637198][curl        ][ns:0] TCP: 172.27.205.177:37410 -> 172.27.205.149:20007 seq:3344869775, ack:0, flags:S
[1630259.258629] [fbc24488][nf_hook_slow        ][cpu:16 ][cali52f76ea9a5][pid:1637198][curl        ][ns:0] TCP: 172.27.205.177:37410 -> 172.27.205.149:20007 seq:3344869775, ack:0, flags:S *ipv4 in chain: POST_ROUTING*
[1630259.258631] [fbc24488][nft_do_chain        ][cpu:16 ][cali52f76ea9a5][pid:1637198][curl        ][ns:0] TCP: 172.27.205.177:37410 -> 172.27.205.149:20007 seq:3344869775, ack:0, flags:S *iptables table:mangle, chain:POSTROU*
[1630259.258633] [fbc24488][nft_do_chain        ][cpu:16 ][cali52f76ea9a5][pid:1637198][curl        ][ns:0] TCP: 172.27.205.177:37410 -> 172.27.205.149:20007 seq:3344869775, ack:0, flags:S *iptables table:nat, chain:POSTROU*
[1630259.258641] [fbc24488][ip_finish_output    ][cpu:16 ][cali52f76ea9a5][pid:1637198][curl        ][ns:0] TCP: 172.27.205.177:37410 -> 172.27.205.149:20007 seq:3344869775, ack:0, flags:S
[1630259.258642] [fbc24488][ip_finish_output2   ][cpu:16 ][cali52f76ea9a5][pid:1637198][curl        ][ns:0] TCP: 172.27.205.177:37410 -> 172.27.205.149:20007 seq:3344869775, ack:0, flags:S
[1630259.258647] [fbc24488][skb_clone           ][cpu:16 ][cali52f76ea9a5][pid:1637198][curl        ][ns:0] TCP: 172.27.205.177:37410 -> 172.27.205.149:20007 seq:3344869775, ack:0, flags:S
[1630259.258658] [4b6161c0][consume_skb         ][cpu:16 ][cali52f76ea9a5][pid:1637198][curl        ][ns:0] TCP: 172.27.205.177:37410 -> 172.27.205.149:20007 seq:3344869775, ack:0, flags:S *packet is freed (normally)*
[1630259.258685] [fbc24488][__dev_queue_xmit    ][cpu:16 ][cali52f76ea9a5][pid:1637198][curl        ][ns:0] TCP: 172.27.205.177:37410 -> 172.27.205.149:20007 seq:3344869775, ack:0, flags:S
[1630259.258688] [fbc24488][dev_hard_start_xmit ][cpu:16 ][cali52f76ea9a5][pid:1637198][curl        ][ns:0] TCP: 172.27.205.177:37410 -> 172.27.205.149:20007 seq:3344869775, ack:0, flags:S *skb is successfully sent to the NIC driver*
[1630259.258689] [fbc24488][enqueue_to_backlog  ][cpu:16 ][eth0 ][pid:1637198][curl        ][ns:0] TCP: 172.27.205.177:37410 -> 172.27.205.149:20007 seq:3344869775, ack:0, flags:S
[1630259.258692] [fbc24488][__netif_receive_skb_core][cpu:16 ][eth0 ][pid:1637198][curl        ][ns:0] TCP: 172.27.205.177:37410 -> 172.27.205.149:20007 seq:3344869775, ack:0, flags:S
[1630259.258694] [fbc24488][tcf_classify        ][cpu:16 ][eth0 ][pid:1637198][curl        ][ns:0] TCP: 172.27.205.177:37410 -> 172.27.205.149:20007 seq:3344869775, ack:0, flags:S
[1630259.258697] [fbc24488][cls_bpf_classify    ][cpu:16 ][eth0 ][pid:1637198][curl        ][ns:0] TCP: 172.27.205.177:37410 -> 172.27.205.149:20007 seq:3344869775, ack:0, flags:S
[1630259.258700] [fbc24488][__dev_queue_xmit    ][cpu:16 ][z192.168.0.3][pid:1637198][curl        ][ns:0] TCP: 172.27.205.177:37410 -> 169.254.68.6:49999 seq:3344869775, ack:0, flags:S
[1630259.258704] [fbc24488][dev_hard_start_xmit ][cpu:16 ][z192.168.0.3][pid:1637198][curl        ][ns:0] TCP: 172.27.205.177:37410 -> 169.254.68.6:49999 seq:3344869775, ack:0, flags:S *skb is successfully sent to the NIC driver*
[1630259.258735] [fbc24488][consume_skb         ][cpu:49 ][z192.168.0.3][pid:4134789][tap-0_qp0   ][ns:0] TCP: 172.27.205.177:37410 -> 169.254.68.6:49999 seq:3344869775, ack:0, flags:S *packet is freed (normally)*
[1630260.295010] [fbc24380][__tcp_transmit_skb  ][cpu:16 ][     ][pid:0      ][swapper/16  ][ns:0] TCP: 172.27.205.177:37410 -> 172.27.205.149:20007 seq:3344869775, ack:0, flags:S
[1630260.295016] [fbc24380][skb_clone           ][cpu:16 ][     ][pid:0      ][swapper/16  ][ns:0] unknow
[1630260.295023] [fbc24488][__ip_queue_xmit     ][cpu:16 ][     ][pid:0      ][swapper/16  ][ns:0] TCP: 172.27.205.177:37410 -> 172.27.205.149:20007 seq:3344869775, ack:0, flags:S
[1630260.295025] [fbc24488][__ip_local_out      ][cpu:16 ][     ][pid:0      ][swapper/16  ][ns:0] TCP: 172.27.205.177:37410 -> 172.27.205.149:20007 seq:3344869775, ack:0, flags:S
[1630260.295027] [fbc24488][nf_hook_slow        ][cpu:16 ][     ][pid:0      ][swapper/16  ][ns:0] TCP: 172.27.205.177:37410 -> 172.27.205.149:20007 seq:3344869775, ack:0, flags:S *ipv4 in chain: OUTPUT*
[1630260.295030] [fbc24488][ip_output           ][cpu:16 ][     ][pid:0      ][swapper/16  ][ns:0] TCP: 172.27.205.177:37410 -> 172.27.205.149:20007 seq:3344869775, ack:0, flags:S
[1630260.295032] [fbc24488][nf_hook_slow        ][cpu:16 ][eth0 ][pid:0      ][swapper/16  ][ns:0] TCP: 172.27.205.177:37410 -> 172.27.205.149:20007 seq:3344869775, ack:0, flags:S *ipv4 in chain: POST_ROUTING*
[1630260.295035] [fbc24488][ip_finish_output    ][cpu:16 ][eth0 ][pid:0      ][swapper/16  ][ns:0] TCP: 172.27.205.177:37410 -> 172.27.205.149:20007 seq:3344869775, ack:0, flags:S
[1630260.295037] [fbc24488][ip_finish_output2   ][cpu:16 ][eth0 ][pid:0      ][swapper/16  ][ns:0] TCP: 172.27.205.177:37410 -> 172.27.205.149:20007 seq:3344869775, ack:0, flags:S
[1630260.295040] [fbc24488][__dev_queue_xmit    ][cpu:16 ][eth0 ][pid:0      ][swapper/16  ][ns:0] TCP: 172.27.205.177:37410 -> 172.27.205.149:20007 seq:3344869775, ack:0, flags:S
[1630260.295043] [fbc24488][dev_hard_start_xmit ][cpu:16 ][eth0 ][pid:0      ][swapper/16  ][ns:0] TCP: 172.27.205.177:37410 -> 172.27.205.149:20007 seq:3344869775, ack:0, flags:S *skb is successfully sent to the NIC driver*
[1630260.295046] [fbc24488][enqueue_to_backlog  ][cpu:16 ][calie858e8b922][pid:0      ][swapper/16  ][ns:0] TCP: 172.27.205.177:37410 -> 172.27.205.149:20007 seq:3344869775, ack:0, flags:S
[1630260.295052] [fbc24488][__netif_receive_skb_core][cpu:16 ][calie858e8b922][pid:0      ][swapper/16  ][ns:0] TCP: 172.27.205.177:37410 -> 172.27.205.149:20007 seq:3344869775, ack:0, flags:S
[1630260.295055] [fbc24488][ip_rcv              ][cpu:16 ][calie858e8b922][pid:0      ][swapper/16  ][ns:0] TCP: 172.27.205.177:37410 -> 172.27.205.149:20007 seq:3344869775, ack:0, flags:S
[1630260.295058] [fbc24488][ip_rcv_core         ][cpu:16 ][calie858e8b922][pid:0      ][swapper/16  ][ns:0] TCP: 172.27.205.177:37410 -> 172.27.205.149:20007 seq:3344869775, ack:0, flags:S
[1630260.295059] [fbc24488][nf_hook_slow        ][cpu:16 ][calie858e8b922][pid:0      ][swapper/16  ][ns:0] TCP: 172.27.205.177:37410 -> 172.27.205.149:20007 seq:3344869775, ack:0, flags:S *ipv4 in chain: PRE_ROUTING*
[1630260.295061] [fbc24488][nft_do_chain        ][cpu:16 ][calie858e8b922][pid:0      ][swapper/16  ][ns:0] TCP: 172.27.205.177:37410 -> 172.27.205.149:20007 seq:3344869775, ack:0, flags:S *iptables table:raw, chain:PREROUT*
[1630260.295069] [fbc24488][nft_do_chain        ][cpu:16 ][calie858e8b922][pid:0      ][swapper/16  ][ns:0] TCP: 172.27.205.177:37410 -> 172.27.205.149:20007 seq:3344869775, ack:0, flags:S *iptables table:mangle, chain:PREROUT*
[1630260.295074] [fbc24488][ip_rcv_finish       ][cpu:16 ][calie858e8b922][pid:0      ][swapper/16  ][ns:0] TCP: 172.27.205.177:37410 -> 172.27.205.149:20007 seq:3344869775, ack:0, flags:S
[1630260.295077] [fbc24488][ip_route_input_slow ][cpu:16 ][calie858e8b922][pid:0      ][swapper/16  ][ns:0] TCP: 172.27.205.177:37410 -> 172.27.205.149:20007 seq:3344869775, ack:0, flags:S
[1630260.295080] [fbc24488][fib_validate_source ][cpu:16 ][calie858e8b922][pid:0      ][swapper/16  ][ns:0] TCP: 172.27.205.177:37410 -> 172.27.205.149:20007 seq:3344869775, ack:0, flags:S
[1630260.295084] [fbc24488][ip_forward          ][cpu:16 ][calie858e8b922][pid:0      ][swapper/16  ][ns:0] TCP: 172.27.205.177:37410 -> 172.27.205.149:20007 seq:3344869775, ack:0, flags:S
[1630260.295086] [fbc24488][nf_hook_slow        ][cpu:16 ][calie858e8b922][pid:0      ][swapper/16  ][ns:0] TCP: 172.27.205.177:37410 -> 172.27.205.149:20007 seq:3344869775, ack:0, flags:S *ipv4 in chain: FORWARD*
[1630260.295088] [fbc24488][nft_do_chain        ][cpu:16 ][calie858e8b922][pid:0      ][swapper/16  ][ns:0] TCP: 172.27.205.177:37410 -> 172.27.205.149:20007 seq:3344869775, ack:0, flags:S *iptables table:filter, chain:FORWARD*
[1630260.295106] [fbc24488][ip_output           ][cpu:16 ][calie858e8b922][pid:0      ][swapper/16  ][ns:0] TCP: 172.27.205.177:37410 -> 172.27.205.149:20007 seq:3344869775, ack:0, flags:S
[1630260.295108] [fbc24488][nf_hook_slow        ][cpu:16 ][cali52f76ea9a5][pid:0      ][swapper/16  ][ns:0] TCP: 172.27.205.177:37410 -> 172.27.205.149:20007 seq:3344869775, ack:0, flags:S *ipv4 in chain: POST_ROUTING*
[1630260.295110] [fbc24488][nft_do_chain        ][cpu:16 ][cali52f76ea9a5][pid:0      ][swapper/16  ][ns:0] TCP: 172.27.205.177:37410 -> 172.27.205.149:20007 seq:3344869775, ack:0, flags:S *iptables table:mangle, chain:POSTROU*
[1630260.295113] [fbc24488][ip_finish_output    ][cpu:16 ][cali52f76ea9a5][pid:0      ][swapper/16  ][ns:0] TCP: 172.27.205.177:37410 -> 172.27.205.149:20007 seq:3344869775, ack:0, flags:S
[1630260.295115] [fbc24488][ip_finish_output2   ][cpu:16 ][cali52f76ea9a5][pid:0      ][swapper/16  ][ns:0] TCP: 172.27.205.177:37410 -> 172.27.205.149:20007 seq:3344869775, ack:0, flags:S
[1630260.295117] [fbc24488][__dev_queue_xmit    ][cpu:16 ][cali52f76ea9a5][pid:0      ][swapper/16  ][ns:0] TCP: 172.27.205.177:37410 -> 172.27.205.149:20007 seq:3344869775, ack:0, flags:S
[1630260.295119] [fbc24488][dev_hard_start_xmit ][cpu:16 ][cali52f76ea9a5][pid:0      ][swapper/16  ][ns:0] TCP: 172.27.205.177:37410 -> 172.27.205.149:20007 seq:3344869775, ack:0, flags:S *skb is successfully sent to the NIC driver*
[1630260.295121] [fbc24488][enqueue_to_backlog  ][cpu:16 ][eth0 ][pid:0      ][swapper/16  ][ns:0] TCP: 172.27.205.177:37410 -> 172.27.205.149:20007 seq:3344869775, ack:0, flags:S
[1630260.295123] [fbc24488][__netif_receive_skb_core][cpu:16 ][eth0 ][pid:0      ][swapper/16  ][ns:0] TCP: 172.27.205.177:37410 -> 172.27.205.149:20007 seq:3344869775, ack:0, flags:S
[1630260.295127] [fbc24488][tcf_classify        ][cpu:16 ][eth0 ][pid:0      ][swapper/16  ][ns:0] TCP: 172.27.205.177:37410 -> 172.27.205.149:20007 seq:3344869775, ack:0, flags:S
[1630260.295131] [fbc24488][cls_bpf_classify    ][cpu:16 ][eth0 ][pid:0      ][swapper/16  ][ns:0] TCP: 172.27.205.177:37410 -> 172.27.205.149:20007 seq:3344869775, ack:0, flags:S
[1630260.295136] [fbc24488][__dev_queue_xmit    ][cpu:16 ][z192.168.0.3][pid:0      ][swapper/16  ][ns:0] TCP: 172.27.205.177:37410 -> 169.254.68.6:49999 seq:3344869775, ack:0, flags:S
[1630260.295139] [fbc24488][dev_hard_start_xmit ][cpu:16 ][z192.168.0.3][pid:0      ][swapper/16  ][ns:0] TCP: 172.27.205.177:37410 -> 169.254.68.6:49999 seq:3344869775, ack:0, flags:S *skb is successfully sent to the NIC driver*
[1630260.295170] [fbc24488][consume_skb         ][cpu:49 ][z192.168.0.3][pid:4134789][tap-0_qp0   ][ns:0] TCP: 172.27.205.177:37410 -> 169.254.68.6:49999 seq:3344869775, ack:0, flags:S *packet is freed (normally)*
[1630261.319009] [fbc24380][__tcp_transmit_skb  ][cpu:16 ][     ][pid:0      ][swapper/16  ][ns:0] TCP: 172.27.205.177:37410 -> 172.27.205.149:20007 seq:3344869775, ack:0, flags:S
[1630261.319015] [fbc24380][skb_clone           ][cpu:16 ][     ][pid:0      ][swapper/16  ][ns:0] unknow
[1630261.319021] [fbc24488][__ip_queue_xmit     ][cpu:16 ][     ][pid:0      ][swapper/16  ][ns:0] TCP: 172.27.205.177:37410 -> 172.27.205.149:20007 seq:3344869775, ack:0, flags:S
[1630261.319024] [fbc24488][__ip_local_out      ][cpu:16 ][     ][pid:0      ][swapper/16  ][ns:0] TCP: 172.27.205.177:37410 -> 172.27.205.149:20007 seq:3344869775, ack:0, flags:S
[1630261.319026] [fbc24488][nf_hook_slow        ][cpu:16 ][     ][pid:0      ][swapper/16  ][ns:0] TCP: 172.27.205.177:37410 -> 172.27.205.149:20007 seq:3344869775, ack:0, flags:S *ipv4 in chain: OUTPUT*
[1630261.319029] [fbc24488][ip_output           ][cpu:16 ][     ][pid:0      ][swapper/16  ][ns:0] TCP: 172.27.205.177:37410 -> 172.27.205.149:20007 seq:3344869775, ack:0, flags:S
[1630261.319030] [fbc24488][nf_hook_slow        ][cpu:16 ][eth0 ][pid:0      ][swapper/16  ][ns:0] TCP: 172.27.205.177:37410 -> 172.27.205.149:20007 seq:3344869775, ack:0, flags:S *ipv4 in chain: POST_ROUTING*
[1630261.319033] [fbc24488][ip_finish_output    ][cpu:16 ][eth0 ][pid:0      ][swapper/16  ][ns:0] TCP: 172.27.205.177:37410 -> 172.27.205.149:20007 seq:3344869775, ack:0, flags:S
[1630261.319035] [fbc24488][ip_finish_output2   ][cpu:16 ][eth0 ][pid:0      ][swapper/16  ][ns:0] TCP: 172.27.205.177:37410 -> 172.27.205.149:20007 seq:3344869775, ack:0, flags:S
[1630261.319037] [fbc24488][__dev_queue_xmit    ][cpu:16 ][eth0 ][pid:0      ][swapper/16  ][ns:0] TCP: 172.27.205.177:37410 -> 172.27.205.149:20007 seq:3344869775, ack:0, flags:S
[1630261.319040] [fbc24488][dev_hard_start_xmit ][cpu:16 ][eth0 ][pid:0      ][swapper/16  ][ns:0] TCP: 172.27.205.177:37410 -> 172.27.205.149:20007 seq:3344869775, ack:0, flags:S *skb is successfully sent to the NIC driver*
[1630261.319043] [fbc24488][enqueue_to_backlog  ][cpu:16 ][calie858e8b922][pid:0      ][swapper/16  ][ns:0] TCP: 172.27.205.177:37410 -> 172.27.205.149:20007 seq:3344869775, ack:0, flags:S
[1630261.319049] [fbc24488][__netif_receive_skb_core][cpu:16 ][calie858e8b922][pid:0      ][swapper/16  ][ns:0] TCP: 172.27.205.177:37410 -> 172.27.205.149:20007 seq:3344869775, ack:0, flags:S
[1630261.319052] [fbc24488][ip_rcv              ][cpu:16 ][calie858e8b922][pid:0      ][swapper/16  ][ns:0] TCP: 172.27.205.177:37410 -> 172.27.205.149:20007 seq:3344869775, ack:0, flags:S
[1630261.319055] [fbc24488][ip_rcv_core         ][cpu:16 ][calie858e8b922][pid:0      ][swapper/16  ][ns:0] TCP: 172.27.205.177:37410 -> 172.27.205.149:20007 seq:3344869775, ack:0, flags:S
[1630261.319057] [fbc24488][nf_hook_slow        ][cpu:16 ][calie858e8b922][pid:0      ][swapper/16  ][ns:0] TCP: 172.27.205.177:37410 -> 172.27.205.149:20007 seq:3344869775, ack:0, flags:S *ipv4 in chain: PRE_ROUTING*
[1630261.319060] [fbc24488][nft_do_chain        ][cpu:16 ][calie858e8b922][pid:0      ][swapper/16  ][ns:0] TCP: 172.27.205.177:37410 -> 172.27.205.149:20007 seq:3344869775, ack:0, flags:S *iptables table:raw, chain:PREROUT*
[1630261.319068] [fbc24488][nft_do_chain        ][cpu:16 ][calie858e8b922][pid:0      ][swapper/16  ][ns:0] TCP: 172.27.205.177:37410 -> 172.27.205.149:20007 seq:3344869775, ack:0, flags:S *iptables table:mangle, chain:PREROUT*
[1630261.319073] [fbc24488][ip_rcv_finish       ][cpu:16 ][calie858e8b922][pid:0      ][swapper/16  ][ns:0] TCP: 172.27.205.177:37410 -> 172.27.205.149:20007 seq:3344869775, ack:0, flags:S
[1630261.319076] [fbc24488][ip_route_input_slow ][cpu:16 ][calie858e8b922][pid:0      ][swapper/16  ][ns:0] TCP: 172.27.205.177:37410 -> 172.27.205.149:20007 seq:3344869775, ack:0, flags:S
[1630261.319079] [fbc24488][fib_validate_source ][cpu:16 ][calie858e8b922][pid:0      ][swapper/16  ][ns:0] TCP: 172.27.205.177:37410 -> 172.27.205.149:20007 seq:3344869775, ack:0, flags:S
[1630261.319083] [fbc24488][ip_forward          ][cpu:16 ][calie858e8b922][pid:0      ][swapper/16  ][ns:0] TCP: 172.27.205.177:37410 -> 172.27.205.149:20007 seq:3344869775, ack:0, flags:S
[1630261.319086] [fbc24488][nf_hook_slow        ][cpu:16 ][calie858e8b922][pid:0      ][swapper/16  ][ns:0] TCP: 172.27.205.177:37410 -> 172.27.205.149:20007 seq:3344869775, ack:0, flags:S *ipv4 in chain: FORWARD*
[1630261.319088] [fbc24488][nft_do_chain        ][cpu:16 ][calie858e8b922][pid:0      ][swapper/16  ][ns:0] TCP: 172.27.205.177:37410 -> 172.27.205.149:20007 seq:3344869775, ack:0, flags:S *iptables table:filter, chain:FORWARD*
[1630261.319107] [fbc24488][ip_output           ][cpu:16 ][calie858e8b922][pid:0      ][swapper/16  ][ns:0] TCP: 172.27.205.177:37410 -> 172.27.205.149:20007 seq:3344869775, ack:0, flags:S

**Comment by chenhengqi** [comment]
/cubebot draw a graph for each scenario described in the issue

**Comment by chenhengqi** [comment]
@wwthw Are there csum errors in the error cases?

**Comment by wwthw** [comment]
> [@wwthw](https://github.com/wwthw) Are there csum errors in the error cases?

I added some eBPF logs and re-captured packets in TAP, and found some csum errors.

Could it be that the local forwarding is missing a pseudo header, causing this problem?


17:17:54.604440 IP (tos 0x0, ttl 63, id 62276, offset 0, flags [DF], proto TCP (6), length 60)
    172.27.205.177.60934 > 169.254.68.6.49999: Flags [S], cksum 0x283f (incorrect -> 0xca4f), seq 921193800, win 64800, options [mss 1440,sackOK,TS val 3143378926 ecr 0,nop,wscale 7], length 0
17:17:55.604709 IP (tos 0x0, ttl 63, id 62277, offset 0, flags [DF], proto TCP (6), length 60)
    172.27.205.177.60934 > 169.254.68.6.49999: Flags [S], cksum 0x2456 (incorrect -> 0xc666), seq 921193800, win 64800, options [mss 1440,sackOK,TS val 3143379927 ecr 0,nop,wscale 7], length 0
17:17:56.628726 IP (tos 0x0, ttl 63, id 62278, offset 0, flags [DF], proto TCP (6), length 60)
    172.27.205.177.60934 > 169.254.68.6.49999: Flags [S], cksum 0x2056 (incorrect -> 0xc266), seq 921193800, win 64800, options [mss 1440,sackOK,TS val 3143380951 ecr 0,nop,wscale 7], length 0
17:17:57.652704 IP (tos 0x0, ttl 63, id 62279, offset 0, flags [DF], proto TCP (6), length 60)
    172.27.205.177.60934 > 169.254.68.6.49999: Flags [S], cksum 0x1c56 (incorrect -> 0xbe66), seq 921193800, win 64800, options [mss 1440,sackOK,TS val 3143381975 ecr 0,nop,wscale 7], length 0
17:17:58.676697 IP (tos 0x0, ttl 63, id 62280, offset 0, flags [DF], proto TCP (6), length 60)
    172.27.205.177.60934 > 169.254.68.6.49999: Flags [S], cksum 0x1856 (incorrect -> 0xba66), seq 921193800, win 64800, options [mss 1440,sackOK,TS val 3143382999 ecr 0,nop,wscale 7], length 0
17:17:59.700704 IP (tos 0x0, ttl 63, id 62281, offset 0, flags [DF], proto TCP (6), length 60)
    172.27.205.177.60934 > 169.254.68.6.49999: Flags [S], cksum 0x1456 (incorrect -> 0xb666), seq 921193800, win 64800, options [mss 1440,sackOK,TS val 3143384023 ecr 0,nop,wscale 7], length 0
17:18:01.748697 IP (tos 0x0, ttl 63, id 62282, offset 0, flags [DF], proto TCP (6), length 60)
    172.27.205.177.60934 > 169.254.68.6.49999: Flags [S], cksum 0x0c56 (incorrect -> 0xae66), seq 921193800, win 64800, options [mss 1440,sackOK,TS val 3143386071 ecr 0,nop,wscale 7], length 0

**Comment by wwthw** [comment]
> [@wwthw](https://github.com/wwthw) Are there csum errors in the error cases?

How to solve this problem?

**Comment by wwthw** [comment]
> > [@wwthw](https://github.com/wwthw) Are there csum errors in the error cases?
> 
> How to solve this problem?

Based on the previous version of the code, this issue was resolved.
However, when the code was updated to the latest version, a cksum error occurred again during the response packet.



[root@master scripts]# tcpdump -i z192.168.0.3 -vv -nn
dropped privs to tcpdump
tcpdump: listening on z192.168.0.3, link-type EN10MB (Ethernet), snapshot length 262144 bytes

17:35:28.948927 IP (tos 0x0, ttl 64, id 0, offset 0, flags [DF], proto TCP (6), length 60)
    169.254.68.6.49999 > 172.27.205.177.41798: Flags [S.], cksum 0x6800 (incorrect -> 0xa4ab), seq 151809694, ack 2744767489, win 64896, options [mss 1260,sackOK,TS val 2563072173 ecr 4231000890,nop,wscale 7], length 0
17:35:37.300694 IP (tos 0x0, ttl 63, id 17192, offset 0, flags [DF], proto TCP (6), length 60)
    172.27.205.177.41798 > 169.254.68.6.49999: Flags [S], cksum 0x8a34 (correct), seq 2744767488, win 64800, options [mss 1440,sackOK,TS val 4231036555 ecr 0,nop,wscale 7], length 0
17:35:37.300869 IP (tos 0x0, ttl 64, id 0, offset 0, flags [DF], proto TCP (6), length 60)
    169.254.68.6.49999 > 172.27.205.177.41798: Flags [S.], cksum 0x6800 (incorrect -> 0x840b), seq 151809694, ack 2744767489, win 64896, options [mss 1260,sackOK,TS val 2563080525 ecr 4231000890,nop,wscale 7], length 0
17:35:38.932931 IP6 (hlim 255, next-header ICMPv6 (58) payload length: 16) fe80::2290:6fff:fefc:fcfc > ff02::2: [icmp6 sum ok] ICMP6, router solicitation, length 16
	  source link-address option (1), length 8 (1): 20:90:6f:fc:fc:fc
	    0x0000:  2090 6ffc fcfc
17:35:53.524947 IP (tos 0x0, ttl 64, id 0, offset 0, flags [DF], proto TCP (6), length 60)
    169.254.68.6.49999 > 172.27.205.177.41798: Flags [S.], cksum 0x6800 (incorrect -> 0x44ab), seq 151809694, ack 2744767489, win 64896, options [mss 1260,sackOK,TS val 2563096749 ecr 4231000890,nop,wscale 7], length 0

**Comment by chenhengqi** [comment]
Fixed in our v0.4.0 release.

https://github.com/TencentCloud/CubeSandbox/releases/tag/v0.4.0
